[
  {
    "hindi": "नमस्ते।",
    "tamil": "வணக்கம்.",
    "pronunciation": "वणक्कम्.",
    "audio_path": "assets/audio/l1_hello.mp3",
    "tags": [
      "lesson:1",
      "topic:survival_basics",
      "grammar:greeting"
    ]
  },
  {
    "hindi": "हाँ, ठीक है।",
    "tamil": "ஆமா, சரி.",
    "pronunciation": "आमा, चरि.",
    "audio_path": "assets/audio/l1_yes_okay.mp3",
    "tags": [
      "lesson:1",
      "topic:survival_basics",
      "grammar:affirmative"
    ]
  },
  {
    "hindi": "मुझे नहीं पता।",
    "tamil": "எனக்குத் தெரியாது.",
    "pronunciation": "ऎऩक्कुत् तॆरियातु.",
    "audio_path": "assets/audio/l1_dont_know.mp3",
    "tags": [
      "lesson:1",
      "topic:survival_basics",
      "grammar:present"
    ]
  },
  {
    "hindi": "जल्दी चलो।",
    "tamil": "சீக்கிரம் போலாம்.",
    "pronunciation": "चीक्किरम् पोलाम्.",
    "audio_path": "assets/audio/l1_go_fast.mp3",
    "tags": [
      "lesson:1",
      "topic:survival_basics",
      "grammar:imperative"
    ]
  },
  {
    "hindi": "मैं जाता हूँ।",
    "tamil": "நான் போறேன்.",
    "pronunciation": "नाऩ् पोऱेऩ्.",
    "audio_path": "assets/audio/l2_i_go.mp3",
    "tags": [
      "lesson:2",
      "topic:pronouns",
      "grammar:present"
    ]
  },
  {
    "hindi": "आप कैसे हैं?",
    "tamil": "நீங்க எப்டி இருக்கீங்க?",
    "pronunciation": "नीङ्क ऎप्टि इरुक्कीङ्क?",
    "audio_path": "assets/audio/l2_how_are_you.mp3",
    "tags": [
      "lesson:2",
      "topic:pronouns",
      "grammar:question"
    ]
  },
  {
    "hindi": "यह मेरा है।",
    "tamil": "இது என்னோடது.",
    "pronunciation": "इतु ऎऩ्ऩोटतु.",
    "audio_path": "assets/audio/l2_this_is_mine.mp3",
    "tags": [
      "grammar:present",
      "lesson:2",
      "lesson:26",
      "topic:possessives",
      "topic:pronouns"
    ]
  },
  {
    "hindi": "वह क्या है?",
    "tamil": "அது என்ன?",
    "pronunciation": "अतु ऎऩ्ऩ?",
    "audio_path": "assets/audio/l2_what_is_that.mp3",
    "tags": [
      "lesson:2",
      "topic:pronouns",
      "grammar:question"
    ]
  },
  {
    "hindi": "यहाँ आओ।",
    "tamil": "இங்க வாங்க.",
    "pronunciation": "इङ्क वाङ्क.",
    "audio_path": "assets/audio/l3_come_here.mp3",
    "tags": [
      "lesson:3",
      "topic:important_verbs",
      "grammar:imperative"
    ]
  },
  {
    "hindi": "वहाँ जाओ।",
    "tamil": "அங்க போங்க.",
    "pronunciation": "अङ्क पोङ्क.",
    "audio_path": "assets/audio/l3_go_there.mp3",
    "tags": [
      "lesson:3",
      "topic:important_verbs",
      "grammar:imperative"
    ]
  },
  {
    "hindi": "खाना खाओ।",
    "tamil": "சாப்பாடு சாப்பிடுங்க.",
    "pronunciation": "चाप्पाटु चाप्पिटुङ्क.",
    "audio_path": "assets/audio/l3_eat_food.mp3",
    "tags": [
      "lesson:3",
      "topic:important_verbs",
      "grammar:imperative"
    ]
  },
  {
    "hindi": "यहाँ बैठो।",
    "tamil": "இங்க உக்காருங்க.",
    "pronunciation": "इङ्क उक्कारुङ्क.",
    "audio_path": "assets/audio/l3_sit_here.mp3",
    "tags": [
      "lesson:3",
      "topic:important_verbs",
      "grammar:imperative"
    ]
  },
  {
    "hindi": "तुम्हारा नाम क्या है?",
    "tamil": "உன் பேரு என்ன?",
    "pronunciation": "उऩ् पेरु ऎऩ्ऩ?",
    "audio_path": "assets/audio/l4_whats_your_name.mp3",
    "tags": [
      "lesson:4",
      "topic:common_questions",
      "grammar:question"
    ]
  },
  {
    "hindi": "तुम कहाँ हो?",
    "tamil": "நீங்க எங்க இருக்கீங்க?",
    "pronunciation": "नीङ्क ऎङ्क इरुक्कीङ्क?",
    "audio_path": "assets/audio/l4_where_are_you.mp3",
    "tags": [
      "lesson:4",
      "topic:common_questions",
      "grammar:question"
    ]
  },
  {
    "hindi": "यह कितना है?",
    "tamil": "இது எவ்ளோ?",
    "pronunciation": "इतु ऎव्ळो?",
    "audio_path": "assets/audio/l4_how_much_is_this.mp3",
    "tags": [
      "lesson:4",
      "topic:common_questions",
      "grammar:question"
    ]
  },
  {
    "hindi": "खाना खाया?",
    "tamil": "சாப்டாச்சா?",
    "pronunciation": "चाप्टाच्चा?",
    "audio_path": "assets/audio/l4_did_you_eat.mp3",
    "tags": [
      "lesson:4",
      "topic:common_questions",
      "grammar:question"
    ]
  },
  {
    "hindi": "अभी आओ।",
    "tamil": "இப்போ வாங்க.",
    "pronunciation": "इप्पो वाङ्क.",
    "audio_path": "assets/audio/l5_come_now.mp3",
    "tags": [
      "lesson:5",
      "topic:connecting_words",
      "grammar:imperative"
    ]
  },
  {
    "hindi": "बाद में जाओ।",
    "tamil": "அப்புறம் போங்க.",
    "pronunciation": "अप्पुऱम् पोङ्क.",
    "audio_path": "assets/audio/l5_go_later.mp3",
    "tags": [
      "lesson:5",
      "topic:connecting_words",
      "grammar:imperative"
    ]
  },
  {
    "hindi": "यहाँ और वहाँ।",
    "tamil": "இங்க அப்புறம் அங்க.",
    "pronunciation": "इङ्क अप्पुऱम् अङ्क.",
    "audio_path": "assets/audio/l5_here_and_there.mp3",
    "tags": [
      "lesson:5",
      "topic:connecting_words",
      "grammar:present"
    ]
  },
  {
    "hindi": "लेकिन क्यों?",
    "tamil": "ஆனா ஏன்?",
    "pronunciation": "आऩा एऩ्?",
    "audio_path": "assets/audio/l5_but_why.mp3",
    "tags": [
      "lesson:5",
      "topic:connecting_words",
      "grammar:question"
    ]
  },
  {
    "hindi": "मुझे दो।",
    "tamil": "எனக்கு குடுங்க.",
    "pronunciation": "ऎऩक्कु कुटुङ्क.",
    "audio_path": "assets/audio/l6_give_me.mp3",
    "tags": [
      "lesson:6",
      "topic:magic_ku",
      "grammar:imperative"
    ]
  },
  {
    "hindi": "आपको क्या चाहिए?",
    "tamil": "உங்களுக்கு என்ன வேணும்?",
    "pronunciation": "उङ्कळुक्कु ऎऩ्ऩ वेणुम्?",
    "audio_path": "assets/audio/l6_what_do_you_want.mp3",
    "tags": [
      "lesson:6",
      "topic:magic_ku",
      "grammar:question"
    ]
  },
  {
    "hindi": "घर को जाओ।",
    "tamil": "வீட்டுக்கு போங்க.",
    "pronunciation": "वीट्टुक्कु पोङ्क.",
    "audio_path": "assets/audio/l6_go_to_house.mp3",
    "tags": [
      "lesson:6",
      "topic:magic_ku",
      "grammar:imperative"
    ]
  },
  {
    "hindi": "दुकान को चलो।",
    "tamil": "கடைக்கு போலாம்.",
    "pronunciation": "कटैक्कु पोलाम्.",
    "audio_path": "assets/audio/l6_lets_go_shop.mp3",
    "tags": [
      "lesson:6",
      "topic:magic_ku",
      "grammar:imperative"
    ]
  },
  {
    "hindi": "मैं घर में हूँ।",
    "tamil": "நான் வீட்ல இருக்கேன்.",
    "pronunciation": "नाऩ् वीट्ल इरुक्केऩ्.",
    "audio_path": "assets/audio/l7_in_house.mp3",
    "tags": [
      "lesson:7",
      "topic:magic_la",
      "grammar:present"
    ]
  },
  {
    "hindi": "रास्ते में हूँ।",
    "tamil": "வழியில இருக்கேன்.",
    "pronunciation": "वऴियिल इरुक्केऩ्.",
    "audio_path": "assets/audio/l7_on_the_way.mp3",
    "tags": [
      "lesson:7",
      "topic:magic_la",
      "grammar:present"
    ]
  },
  {
    "hindi": "गाड़ी में बैठो।",
    "tamil": "வண்டில உக்காருங்க.",
    "pronunciation": "वण्टिल उक्कारुङ्क.",
    "audio_path": "assets/audio/l7_sit_in_car.mp3",
    "tags": [
      "lesson:7",
      "topic:magic_la",
      "grammar:imperative"
    ]
  },
  {
    "hindi": "हाथ में क्या है?",
    "tamil": "கைல என்ன இருக்கு?",
    "pronunciation": "कैल ऎऩ्ऩ इरुक्कु?",
    "audio_path": "assets/audio/l7_what_in_hand.mp3",
    "tags": [
      "lesson:7",
      "topic:magic_la",
      "grammar:question"
    ]
  },
  {
    "hindi": "मैं गया।",
    "tamil": "நான் போனேன்.",
    "pronunciation": "नाऩ् पोऩेऩ्.",
    "audio_path": "assets/audio/l8_i_went.mp3",
    "tags": [
      "lesson:8",
      "topic:past_tense",
      "grammar:past"
    ]
  },
  {
    "hindi": "मैं आया।",
    "tamil": "நான் வந்தேன்.",
    "pronunciation": "नाऩ् वन्तेऩ्.",
    "audio_path": "assets/audio/l8_i_came.mp3",
    "tags": [
      "lesson:8",
      "topic:past_tense",
      "grammar:past"
    ]
  },
  {
    "hindi": "मैंने देखा।",
    "tamil": "நான் பாத்தேன்.",
    "pronunciation": "नाऩ् पात्तेऩ्.",
    "audio_path": "assets/audio/l8_i_saw.mp3",
    "tags": [
      "lesson:8",
      "topic:past_tense",
      "grammar:past"
    ]
  },
  {
    "hindi": "काम खत्म हो गया।",
    "tamil": "வேல முடிஞ்சுது.",
    "pronunciation": "वेल मुटिञ्चुतु.",
    "audio_path": "assets/audio/l8_work_finished.mp3",
    "tags": [
      "lesson:8",
      "topic:past_tense",
      "grammar:past"
    ]
  },
  {
    "hindi": "मैं जा रहा हूँ।",
    "tamil": "நான் போறேன்.",
    "pronunciation": "नाऩ् पोऱेऩ्.",
    "audio_path": "assets/audio/l9_im_going.mp3",
    "tags": [
      "lesson:9",
      "topic:present_continuous",
      "grammar:present_continuous"
    ]
  },
  {
    "hindi": "मैं आ रहा हूँ।",
    "tamil": "நான் வர்றேன்.",
    "pronunciation": "नाऩ् वर्ऱेऩ्.",
    "audio_path": "assets/audio/l9_im_coming.mp3",
    "tags": [
      "lesson:9",
      "topic:present_continuous",
      "grammar:present_continuous"
    ]
  },
  {
    "hindi": "बारिश हो रही है।",
    "tamil": "மழை பெய்யுது.",
    "pronunciation": "मऴै पॆय्युतु.",
    "audio_path": "assets/audio/l9_raining.mp3",
    "tags": [
      "grammar:present_continuous",
      "lesson:34",
      "lesson:9",
      "topic:present_continuous",
      "topic:weather"
    ]
  },
  {
    "hindi": "क्या कर रहे हो?",
    "tamil": "என்ன பண்றீங்க?",
    "pronunciation": "ऎऩ्ऩ पण्ऱीङ्क?",
    "audio_path": "assets/audio/l9_what_doing.mp3",
    "tags": [
      "lesson:9",
      "topic:present_continuous",
      "grammar:question"
    ]
  },
  {
    "hindi": "मुझे नहीं चाहिए।",
    "tamil": "எனக்கு வேணாம்.",
    "pronunciation": "ऎऩक्कु वेणाम्.",
    "audio_path": "assets/audio/l10_i_dont_want.mp3",
    "tags": [
      "grammar:negative",
      "lesson:10",
      "lesson:23",
      "topic:negation",
      "topic:wants_and_needs"
    ]
  },
  {
    "hindi": "मुझे पसंद नहीं है।",
    "tamil": "எனக்கு பிடிக்கல.",
    "pronunciation": "ऎऩक्कु पिटिक्कल.",
    "audio_path": "assets/audio/l10_i_dont_like.mp3",
    "tags": [
      "lesson:10",
      "topic:negation",
      "grammar:negative"
    ]
  },
  {
    "hindi": "मेरे पास नहीं है।",
    "tamil": "என்கிட்ட இல்ல.",
    "pronunciation": "ऎऩ्किट्ट इल्ल.",
    "audio_path": "assets/audio/l10_i_dont_have.mp3",
    "tags": [
      "lesson:10",